<?xml version="1.0" encoding="UTF-8"?>
<!DOCTYPE FeedbackDaten SYSTEM "test.dtd"><FeedbackDaten Datum="08.01.2022" Uhrzeit="10:02:02"><PersoenlicheDaten id="1" position="test"><Anrede>Herr</Anrede><Vorname>Max</Vorname><Nachname>Mustermann</Nachname><Alter>30</Alter><Telefonnummer>1234567890</Telefonnummer><Emailadresse>test@web.de</Emailadresse><Webseite>-</Webseite></PersoenlicheDaten><Checkboxen id="2" position="test2"><Mailbox>ausgewählt</Mailbox><Rueckfragen>zur Verfügung</Rueckfragen><erneuterBesuch>Ja</erneuterBesuch></Checkboxen><EntdecktDurch id="3" position="test3"><AufmerksamDurch>Suchmaschine</AufmerksamDurch></EntdecktDurch><Noten id="4" position="test4"><NoteInhalt>2</NoteInhalt><NoteAussehen>2</NoteAussehen></Noten><Verbesserung id="5" position="test5"><Vorschlag>Dies ist ein Test</Vorschlag></Verbesserung><Spamschutz id="6" position="test6"><Passwort>Internetsprachen</Passwort></Spamschutz></FeedbackDaten>
