<?xml version="1.0" encoding="UTF-8"?>
<!DOCTYPE FeedbackDaten SYSTEM "test.dtd"><FeedbackDaten Datum="02.01.2022" Uhrzeit="12:13:15"><PersoenlicheDaten id="1" position="test"><Anrede>Herr</Anrede><Vorname>dfgh</Vorname><Nachname>gfhjx</Nachname><Alter>21</Alter><Telefonnummer>3465</Telefonnummer><Emailadresse>test@web.de</Emailadresse><Webseite>tedzWebseite</Webseite></PersoenlicheDaten><Checkboxen id="2" position="test2"><Mailbox>ausgewählt</Mailbox><Rueckfragen>zur Verfügung</Rueckfragen><erneuterBesuch>Ja</erneuterBesuch></Checkboxen><EntdecktDurch id="3" position="test3"><AufmerksamDurch>Linkliste</AufmerksamDurch></EntdecktDurch><Noten id="4" position="test4"><NoteInhalt>3</NoteInhalt><NoteAussehen>2</NoteAussehen></Noten><Verbesserung id="5" position="test5"><Vorschlag></Vorschlag></Verbesserung><Spamschutz id="6" position="test6"><Passwort>Internetsprachen</Passwort></Spamschutz></FeedbackDaten>
