<?xml version="1.0" encoding="UTF-8"?>
<!DOCTYPE FeedbackDaten SYSTEM "test.dtd"><FeedbackDaten Datum="04.01.2022" Uhrzeit="04:42:49"><PersoenlicheDaten id="1" position="test"><Anrede>Prof.</Anrede><Vorname>lukas</Vorname><Nachname>ver</Nachname><Alter>26</Alter><Telefonnummer>234456</Telefonnummer><Emailadresse>ayxxx@web.de</Emailadresse><Webseite>tedzWebseite</Webseite></PersoenlicheDaten><Checkboxen id="2" position="test2"><Mailbox>ausgewählt</Mailbox><Rueckfragen>zur Verfügung</Rueckfragen><erneuterBesuch>Ja</erneuterBesuch></Checkboxen><EntdecktDurch id="3" position="test3"><AufmerksamDurch>Freunde/Bekannte</AufmerksamDurch></EntdecktDurch><Noten id="4" position="test4"><NoteInhalt>5</NoteInhalt><NoteAussehen>4</NoteAussehen></Noten><Verbesserung id="5" position="test5"><Vorschlag>HAllo Test 1234.</Vorschlag></Verbesserung><Spamschutz id="6" position="test6"><Passwort>Internetsprachen</Passwort></Spamschutz></FeedbackDaten>
